News date,News title,News image
"30. DECEMBER 2020","Kommentar: Corona rusker op i vanetænkningen",""
"07. FEBRUAR 2020","Pressemeddelelse - Kammeradvokatens undersøgelse",""
"09. DECEMBER 2019","Vi skal værne om en ansvarlig eliteidræt",""
"20. SEPTEMBER 2018","Eliteidrætten har brug for DR Sporten",""
"20. SEPTEMBER 2018","Ny tænketank skal styrke mental sundhed i eliteidræt",""
"- 06. SEPTEMBER 2018","Dansk idræt står ved en skillevej",""
"12. JUNI 2018","Team Danmark søger uddannelsespartnere",""
